{
  "interpretation_id": "lovefu-hillbed-search-rsa-real-uat-v1-2",
  "brand_name": "LOVEFU大島樂眠",
  "product_name": "山丘樂眠床",
  "campaign_type": "search_rsa",
  "goal": "purchase",
  "reporting_period": {
    "start_date": "2025-09-01",
    "end_date": "2026-03-14"
  },
  "performance_data": {
    "reporting_context": {
      "asset_granularity": "asset_association_estimate",
      "includes_asset_level_conversion": false,
      "includes_asset_level_conversion_value": false,
      "includes_placement_breakout": false,
      "interpretation_layers": {
        "click_layer": {
          "status": "missing",
          "required_fields": [
            "impressions",
            "clicks",
            "ctr",
            "active_duration_days"
          ],
          "notes": "CSV 有點擊／曝光欄位，但全數為 0；active_duration_days 來源缺失。"
        },
        "conversion_layer": {
          "status": "partial",
          "required_fields": [
            "impressions",
            "clicks",
            "ctr",
            "asset_level_conversions",
            "active_duration_days"
          ],
          "recommended_fields": [
            "conversion_value",
            "placement_breakout"
          ],
          "notes": "只有跨多個 conversion action 的 asset association proxy，沒有真實 asset-level purchase conversions。"
        },
        "placement_layer": {
          "status": "missing",
          "required_fields": [
            "placement_breakout",
            "impressions",
            "clicks",
            "ctr"
          ],
          "notes": "素材關聯報表沒有 placement breakout。"
        },
        "duration_layer": {
          "status": "missing",
          "required_fields": [
            "active_duration_days"
          ],
          "notes": "CSV 沒有 active_duration_days，runtime 僅以 0 placeholder 滿足 schema。"
        }
      },
      "notes": "真實來源為素材資源關聯報表。曝光、點擊、CTR 全為 0；轉換欄位為 association proxy，非嚴格 asset-level conversion。"
    },
    "assets": [
      {
        "asset_id": "hl-01",
        "asset_type": "headline",
        "text": "200kg 不塌陷，最好睡的撐腰床墊",
        "angle_key": "concrete_number",
        "metrics": {
          "impressions": 0,
          "clicks": 0,
          "ctr": 0,
          "association_proxy_conversions": 213.19
        },
        "active_duration_days": 0,
        "status": "enabled"
      },
      {
        "asset_id": "hl-02",
        "asset_type": "headline",
        "text": "大島樂眠 LOVEFU 飄雲專利床墊",
        "angle_key": "brand_trust",
        "metrics": {
          "impressions": 0,
          "clicks": 0,
          "ctr": 0,
          "association_proxy_conversions": 157.36
        },
        "active_duration_days": 0,
        "status": "enabled"
      },
      {
        "asset_id": "hl-03",
        "asset_type": "headline",
        "text": "不再背痛失眠－LOVEFU山丘樂眠床",
        "angle_key": "pain_point",
        "metrics": {
          "impressions": 0,
          "clicks": 0,
          "ctr": 0,
          "association_proxy_conversions": 152.26
        },
        "active_duration_days": 0,
        "status": "enabled"
      },
      {
        "asset_id": "hl-04",
        "asset_type": "headline",
        "text": "100% MIT 更精湛的製床造詣",
        "angle_key": "concrete_number",
        "metrics": {
          "impressions": 0,
          "clicks": 0,
          "ctr": 0,
          "association_proxy_conversions": 73.97
        },
        "active_duration_days": 0,
        "status": "enabled"
      },
      {
        "asset_id": "hl-05",
        "asset_type": "headline",
        "text": "LOVEFU 飄雲床墊，97%壓倒性評價",
        "angle_key": "social_proof",
        "metrics": {
          "impressions": 0,
          "clicks": 0,
          "ctr": 0,
          "association_proxy_conversions": 58.79
        },
        "active_duration_days": 0,
        "status": "enabled"
      },
      {
        "asset_id": "hl-06",
        "asset_type": "headline",
        "text": "100 天安心睡計畫，改善睡眠品質",
        "angle_key": "risk_reversal",
        "metrics": {
          "impressions": 0,
          "clicks": 0,
          "ctr": 0,
          "association_proxy_conversions": 57.43
        },
        "active_duration_days": 0,
        "status": "enabled"
      },
      {
        "asset_id": "hl-07",
        "asset_type": "headline",
        "text": "專為台灣人的睡眠需求設計",
        "angle_key": "brand_trust",
        "metrics": {
          "impressions": 0,
          "clicks": 0,
          "ctr": 0,
          "association_proxy_conversions": 36.98
        },
        "active_duration_days": 0,
        "status": "enabled"
      },
      {
        "asset_id": "hl-08",
        "asset_type": "headline",
        "text": "大島樂眠床墊－MIT 床墊首選",
        "angle_key": "entry_value",
        "metrics": {
          "impressions": 0,
          "clicks": 0,
          "ctr": 0,
          "association_proxy_conversions": 28.81
        },
        "active_duration_days": 0,
        "status": "enabled"
      },
      {
        "asset_id": "hl-09",
        "asset_type": "headline",
        "text": "LOVEFU 飄雲床墊，樂眠好評如潮",
        "angle_key": "social_proof",
        "metrics": {
          "impressions": 0,
          "clicks": 0,
          "ctr": 0,
          "association_proxy_conversions": 26.61
        },
        "active_duration_days": 0,
        "status": "enabled"
      },
      {
        "asset_id": "hl-10",
        "asset_type": "headline",
        "text": "多尺寸床墊，IKEA MUJI 完美 fit",
        "angle_key": "brand_trust",
        "metrics": {
          "impressions": 0,
          "clicks": 0,
          "ctr": 0,
          "association_proxy_conversions": 23.69
        },
        "active_duration_days": 0,
        "status": "enabled"
      },
      {
        "asset_id": "hl-11",
        "asset_type": "headline",
        "text": "指定配送日，LOVEFU 配送超方便",
        "angle_key": "cta_lower_friction",
        "metrics": {
          "impressions": 0,
          "clicks": 0,
          "ctr": 0,
          "association_proxy_conversions": 23.0
        },
        "active_duration_days": 0,
        "status": "enabled"
      },
      {
        "asset_id": "hl-12",
        "asset_type": "headline",
        "text": "2026 護脊床墊推薦 - 山丘樂眠床",
        "angle_key": "legacy_phrase",
        "metrics": {
          "impressions": 0,
          "clicks": 0,
          "ctr": 0,
          "association_proxy_conversions": 20.65
        },
        "active_duration_days": 0,
        "status": "enabled"
      },
      {
        "asset_id": "hl-13",
        "asset_type": "headline",
        "text": "台灣製床墊，SGS 與歐盟多項認證",
        "angle_key": "brand_trust",
        "metrics": {
          "impressions": 0,
          "clicks": 0,
          "ctr": 0,
          "association_proxy_conversions": 17.57
        },
        "active_duration_days": 0,
        "status": "enabled"
      },
      {
        "asset_id": "hl-14",
        "asset_type": "headline",
        "text": "硬床選擇，LOVEFU 專利舒適",
        "angle_key": "brand_trust",
        "metrics": {
          "impressions": 0,
          "clicks": 0,
          "ctr": 0,
          "association_proxy_conversions": 15.62
        },
        "active_duration_days": 0,
        "status": "enabled"
      },
      {
        "asset_id": "hl-15",
        "asset_type": "headline",
        "text": "LOVEFU山丘樂眠床－腰臀健康首選",
        "angle_key": "entry_value",
        "metrics": {
          "impressions": 0,
          "clicks": 0,
          "ctr": 0,
          "association_proxy_conversions": 13.57
        },
        "active_duration_days": 0,
        "status": "enabled"
      },
      {
        "asset_id": "hl-16",
        "asset_type": "headline",
        "text": "專為台灣設計的 LOVEFU 床墊",
        "angle_key": "brand_trust",
        "metrics": {
          "impressions": 0,
          "clicks": 0,
          "ctr": 0,
          "association_proxy_conversions": 13.32
        },
        "active_duration_days": 0,
        "status": "enabled"
      },
      {
        "asset_id": "hl-17",
        "asset_type": "headline",
        "text": "LOVEFU 硬床墊，舒緩腰痛設計",
        "angle_key": "pain_point",
        "metrics": {
          "impressions": 0,
          "clicks": 0,
          "ctr": 0,
          "association_proxy_conversions": 12.03
        },
        "active_duration_days": 0,
        "status": "enabled"
      },
      {
        "asset_id": "hl-18",
        "asset_type": "headline",
        "text": "硬床墊選擇，LOVEFU 專利舒適",
        "angle_key": "brand_trust",
        "metrics": {
          "impressions": 0,
          "clicks": 0,
          "ctr": 0,
          "association_proxy_conversions": 12.0
        },
        "active_duration_days": 0,
        "status": "enabled"
      },
      {
        "asset_id": "hl-19",
        "asset_type": "headline",
        "text": "LOVEFU 硬床墊，支撐舒適兩全",
        "angle_key": "product_feel",
        "metrics": {
          "impressions": 0,
          "clicks": 0,
          "ctr": 0,
          "association_proxy_conversions": 11.37
        },
        "active_duration_days": 0,
        "status": "enabled"
      },
      {
        "asset_id": "hl-20",
        "asset_type": "headline",
        "text": "單人床墊，飄雲專利解決問題",
        "angle_key": "brand_trust",
        "metrics": {
          "impressions": 0,
          "clicks": 0,
          "ctr": 0,
          "association_proxy_conversions": 10.56
        },
        "active_duration_days": 0,
        "status": "enabled"
      },
      {
        "asset_id": "hl-21",
        "asset_type": "headline",
        "text": "200kg 不塌陷的 LOVEFU 獨立筒",
        "angle_key": "concrete_number",
        "metrics": {
          "impressions": 0,
          "clicks": 0,
          "ctr": 0,
          "association_proxy_conversions": 10.34
        },
        "active_duration_days": 0,
        "status": "enabled"
      },
      {
        "asset_id": "hl-22",
        "asset_type": "headline",
        "text": "單人床墊，飄雲專利無壓舒適",
        "angle_key": "brand_trust",
        "metrics": {
          "impressions": 0,
          "clicks": 0,
          "ctr": 0,
          "association_proxy_conversions": 10.0
        },